"Status","Start Time","Stop Time","Duration in ms","Parent Suite","Suite","Sub Suite","Test Class","Test Method","Name","Description"
"passed","Tue May 19 20:47:43 UTC 2026","Tue May 19 20:47:43 UTC 2026","223","","TC-116: Параметризованный запрос GET для /comments по id=1..10","","org.izuum.jsonPlaceholder.apiTests.dataDrivenTests.ParameterizedRunGetCommentTest","parameterizedGetCommentsTest","TC-116: Проверка что каждый запрос по id возвращает валидный comment [8] 8",""
"passed","Tue May 19 20:47:40 UTC 2026","Tue May 19 20:47:40 UTC 2026","121","","TC-115: Параметризованный запрос GET для /posts по id=1..10","","org.izuum.jsonPlaceholder.apiTests.dataDrivenTests.ParameterizedRunGetPostTest","parameterizedGetPostTest","TC-115: Проверка что каждый запрос по id возвращает валидный объект и совпадающий id [2] 2",""
"passed","Tue May 19 20:47:51 UTC 2026","Tue May 19 20:47:51 UTC 2026","100","","TC-123: Параметризованный запрос GET для /users/{id}/todos по id=1..5","","org.izuum.jsonPlaceholder.apiTests.dataDrivenTests.ParameterizedRunGetUserWithNestedToDosTest","parameterizedGetUserWithNestedTodosTest","TC-123: Проверка что у всех элементов userId совпадает c параметром id [1] 1",""
"passed","Tue May 19 20:47:46 UTC 2026","Tue May 19 20:47:46 UTC 2026","196","","TC-122: Параметризованный запрос GET для /users/{id}/albums по id=1..5","","org.izuum.jsonPlaceholder.apiTests.dataDrivenTests.ParameterizedRunGetUserWithNestedAlbumsTest","parameterizedGetUserWithNestedAlbumsTest","TC-122: Проверка что у всех элементов userId совпадает с параметром id [3] 3",""
"passed","Tue May 19 20:47:52 UTC 2026","Tue May 19 20:47:52 UTC 2026","190","","TC-123: Параметризованный запрос GET для /users/{id}/todos по id=1..5","","org.izuum.jsonPlaceholder.apiTests.dataDrivenTests.ParameterizedRunGetUserWithNestedToDosTest","parameterizedGetUserWithNestedTodosTest","TC-123: Проверка что у всех элементов userId совпадает c параметром id [5] 5",""
"passed","Tue May 19 20:47:46 UTC 2026","Tue May 19 20:47:46 UTC 2026","111","","TC-120: Параметризованный запрос GET для /users по id=1..10","","org.izuum.jsonPlaceholder.apiTests.dataDrivenTests.ParameterizedRunGetUserTest","parameterizedGetUserTest","TC-120: Проверка что каждый запрос по id возвращает валидный user [10] 10",""
"passed","Tue May 19 20:47:43 UTC 2026","Tue May 19 20:47:43 UTC 2026","107","","TC-119: Параметризованный запрос GET для /todos по id=1..10","","org.izuum.jsonPlaceholder.apiTests.dataDrivenTests.ParameterizedRunGetToDoTest","parameterizedGetToDoTest","TC-119: Проверка что каждый запрос по id возвращает валидный todo [1] 1",""
"passed","Tue May 19 20:47:47 UTC 2026","Tue May 19 20:47:47 UTC 2026","99","","TC-117: Параметризованный запрос GET для /albums по id=1..10","","org.izuum.jsonPlaceholder.apiTests.dataDrivenTests.ParameterizedRunGetAlbumTest","parameterizedGetAlbumTest","TC-117: Проверка что каждый запрос по id возвращает валидный album [2] 2",""
"passed","Tue May 19 20:48:11 UTC 2026","Tue May 19 20:48:12 UTC 2026","89","","TC-052: Запрос post с несуществующим id","","org.izuum.jsonPlaceholder.apiTests.negativeReadTests.GetPostByNotExistsIdTest","checkExpectedNotFoundAndEmptyBody","TC-052: Ожидается ошибка 404 и пустое тело объекта",""
"passed","Tue May 19 20:48:04 UTC 2026","Tue May 19 20:48:04 UTC 2026","116","","TC-091: Удаление несуществующего ресурса","","org.izuum.jsonPlaceholder.apiTests.deleteDataTests.DeleteNotExistsPostTest","checkStatusCodeOfDeleteNotExistsPost","TC-091: Статус-код не 5хх, фиксация контракта",""
"passed","Tue May 19 20:47:49 UTC 2026","Tue May 19 20:47:49 UTC 2026","212","","TC-118: Параметризованный запрос GET для /photos по id=1..10","","org.izuum.jsonPlaceholder.apiTests.dataDrivenTests.ParameterizedRunGetPhotoTest","parameterizedGetPhotoTest","TC-118: Проверка что каждый запрос по id возвращает валидный photo [4] 4",""
"passed","Tue May 19 20:47:51 UTC 2026","Tue May 19 20:47:51 UTC 2026","95","","TC-121: Параметризованный запрос GET для /users/{id}/posts по id=1..5","","org.izuum.jsonPlaceholder.apiTests.dataDrivenTests.ParameterizedRunGetUserWithNestedPostsTest","parameterizedGetUserWithNestedPostsTest","TC-121: Проверка что у всех элементов userId совпадает с параметром id [2] 2",""
"passed","Tue May 19 20:48:09 UTC 2026","Tue May 19 20:48:09 UTC 2026","158","","TC-069: Создание post с очень длинными значениями title/body","","org.izuum.jsonPlaceholder.apiTests.createResources.CreatePostWithLongValueTest","checkThatDataReturnWithoutTrim","TC-069: Данные возвращаются без обрезки в теле ответа [4] 10000",""
"passed","Tue May 19 20:48:15 UTC 2026","Tue May 19 20:48:15 UTC 2026","83","","TC-026: Фильтрация comments по postId","","org.izuum.jsonPlaceholder.apiTests.filterQueryParamTests.FilteringCommentsByPostIdTest","checkThatAllElementsOfCommentHasSpecificPostId","TC-026: Все элементы comment имеют postId = 1",""
"passed","Tue May 19 20:47:48 UTC 2026","Tue May 19 20:47:48 UTC 2026","139","","TC-117: Параметризованный запрос GET для /albums по id=1..10","","org.izuum.jsonPlaceholder.apiTests.dataDrivenTests.ParameterizedRunGetAlbumTest","parameterizedGetAlbumTest","TC-117: Проверка что каждый запрос по id возвращает валидный album [8] 8",""
"passed","Tue May 19 20:47:59 UTC 2026","Tue May 19 20:47:59 UTC 2026","93","","TC-041: Получение albums пользователя","","org.izuum.jsonPlaceholder.apiTests.nestedRoutesTests.GetAlbumsOfUserTest","checkThatEveryElementsHasUserIdIsOne","TC-041: Каждый элемент имеет userId=1",""
"passed","Tue May 19 20:47:40 UTC 2026","Tue May 19 20:47:40 UTC 2026","218","","TC-115: Параметризованный запрос GET для /posts по id=1..10","","org.izuum.jsonPlaceholder.apiTests.dataDrivenTests.ParameterizedRunGetPostTest","parameterizedGetPostTest","TC-115: Проверка что каждый запрос по id возвращает валидный объект и совпадающий id [8] 8",""
"passed","Tue May 19 20:48:08 UTC 2026","Tue May 19 20:48:09 UTC 2026","565","","TC-069: Создание post с очень длинными значениями title/body","","org.izuum.jsonPlaceholder.apiTests.createResources.CreatePostWithLongValueTest","checkThatStableAnswerOfServer","TC-069: Сервис отвечает стабильно [4] 10000",""
"passed","Tue May 19 20:47:44 UTC 2026","Tue May 19 20:47:44 UTC 2026","98","","TC-119: Параметризованный запрос GET для /todos по id=1..10","","org.izuum.jsonPlaceholder.apiTests.dataDrivenTests.ParameterizedRunGetToDoTest","parameterizedGetToDoTest","TC-119: Проверка что каждый запрос по id возвращает валидный todo [7] 7",""
"passed","Tue May 19 20:47:55 UTC 2026","Tue May 19 20:47:55 UTC 2026","105","","Проверка типов полей на всех эндпоинтах","","org.izuum.jsonPlaceholder.apiTests.structureAndTypeTests.CheckTypeOfFieldsTest","checkTypeOfFieldsOfToDo","TC-017: Проверка типов полей todo",""
"passed","Tue May 19 20:47:58 UTC 2026","Tue May 19 20:47:58 UTC 2026","93","","TC-049: Получение nested route для несуществующего post","","org.izuum.jsonPlaceholder.apiTests.nestedRoutesTests.GetNotExistsNestedRouteForPostTest","checkThatResponseHasEmptyList","TC-049: Ответ содержит пустой массив",""
"passed","Tue May 19 20:48:02 UTC 2026","Tue May 19 20:48:02 UTC 2026","85","","TC-001: Получение коллекции posts","","org.izuum.jsonPlaceholder.apiTests.smokeTests.GetCollectionOfPostsTest","getRequestCheckResponseIsAnArray","TC-001: Ответом является массив",""
"passed","Tue May 19 20:47:43 UTC 2026","Tue May 19 20:47:43 UTC 2026","222","","TC-116: Параметризованный запрос GET для /comments по id=1..10","","org.izuum.jsonPlaceholder.apiTests.dataDrivenTests.ParameterizedRunGetCommentTest","parameterizedGetCommentsTest","TC-116: Проверка что каждый запрос по id возвращает валидный comment [10] 10",""
"passed","Tue May 19 20:47:57 UTC 2026","Tue May 19 20:47:57 UTC 2026","188","","Сравнение nested route с фильтрациями","","org.izuum.jsonPlaceholder.apiTests.nestedRoutesTests.CompareNestedRouteAndFilteringTest","checkThatSetsOfIdOfCommentsAreEquals","TC-044: Фильтрация для comments. Наборы id в обоих ответах идентичны",""
"passed","Tue May 19 20:47:38 UTC 2026","Tue May 19 20:47:39 UTC 2026","316","","TC-097: Сравнение полученного user и posts относящиеся к этому user","","org.izuum.jsonPlaceholder.apiTests.integrationTests.GetUserAndChainedPostsTest","getUserAndChainedPosts","TC-097: id пользователя используется во всех posts, данные консистентны",""
"passed","Tue May 19 20:48:06 UTC 2026","Tue May 19 20:48:06 UTC 2026","114","","TC-068:(БАГ) Создание post с невалидным JSON Payload","","org.izuum.jsonPlaceholder.apiTests.createResources.CreatePostWithInvalidJsonPayloadTest","checkThatClientAndServerHandlesErrorCorrectly","TC-068:(БАГ) Клиент/сервер корректно обрабатывает ошибку [5] ""not a json at all""",""
"passed","Tue May 19 20:48:14 UTC 2026","Tue May 19 20:48:14 UTC 2026","86","","TC-029: Фильтрация todos по userId","","org.izuum.jsonPlaceholder.apiTests.filterQueryParamTests.FilteringToDosByUserIdTest","checkThatAllToDosHasSpecificUserId","TC-029: Каждый todo содержит userId = 1",""
"passed","Tue May 19 20:48:04 UTC 2026","Tue May 19 20:48:04 UTC 2026","233","","TC-090: Повторное удаление одного и того же ресурса","","org.izuum.jsonPlaceholder.apiTests.deleteDataTests.RepeatDeletePostTest","checkStatusCodeOfRepeatDeletePost","TC-090: Статус-код не 5хх, фиксация идемпотентности",""
"passed","Tue May 19 20:47:56 UTC 2026","Tue May 19 20:47:56 UTC 2026","108","","Проверка структуры объектов на каждом эндпоинте","","org.izuum.jsonPlaceholder.apiTests.structureAndTypeTests.CheckStructureOfObjectsTest","checkStructureOfCompany","TC-021: Проверка структуры company у объекта user",""
"passed","Tue May 19 20:48:09 UTC 2026","Tue May 19 20:48:09 UTC 2026","185","","TC-069: Создание post с очень длинными значениями title/body","","org.izuum.jsonPlaceholder.apiTests.createResources.CreatePostWithLongValueTest","checkThatDataReturnWithoutTrim","TC-069: Данные возвращаются без обрезки в теле ответа [3] 5000",""
"passed","Tue May 19 20:48:16 UTC 2026","Tue May 19 20:48:16 UTC 2026","80","","TC-027: Фильтрация albums по userId","","org.izuum.jsonPlaceholder.apiTests.filterQueryParamTests.FilteringAlbumsByUserIdTest","getRequestCheckStatusCode","TC-027: Статус-код 200",""
"passed","Tue May 19 20:48:08 UTC 2026","Tue May 19 20:48:08 UTC 2026","551","","TC-069: Создание post с очень длинными значениями title/body","","org.izuum.jsonPlaceholder.apiTests.createResources.CreatePostWithLongValueTest","checkThatStableAnswerOfServer","TC-069: Сервис отвечает стабильно [3] 5000",""
"passed","Tue May 19 20:47:47 UTC 2026","Tue May 19 20:47:47 UTC 2026","266","","TC-117: Параметризованный запрос GET для /albums по id=1..10","","org.izuum.jsonPlaceholder.apiTests.dataDrivenTests.ParameterizedRunGetAlbumTest","parameterizedGetAlbumTest","TC-117: Проверка что каждый запрос по id возвращает валидный album [3] 3",""
"passed","Tue May 19 20:47:39 UTC 2026","Tue May 19 20:47:39 UTC 2026","314","","TC-100: Сравнение полученного user и todo относящиеся к user","","org.izuum.jsonPlaceholder.apiTests.integrationTests.GetUserAndChainedTodosTest","getUserAndChainedTodosTest","TC-100: Проверка что каждый todo.userId совпадает с user.id",""
"passed","Tue May 19 20:47:41 UTC 2026","Tue May 19 20:47:41 UTC 2026","107","","TC-115: Параметризованный запрос GET для /posts по id=1..10","","org.izuum.jsonPlaceholder.apiTests.dataDrivenTests.ParameterizedRunGetPostTest","parameterizedGetPostTest","TC-115: Проверка что каждый запрос по id возвращает валидный объект и совпадающий id [10] 10",""
"passed","Tue May 19 20:48:06 UTC 2026","Tue May 19 20:48:07 UTC 2026","200","","TC-064: Создание post только с обязательными полями","","org.izuum.jsonPlaceholder.apiTests.createResources.CreatePostWithRequiredFieldsTest","checkThatServiceReturnMock","TC-064: Сервис возвращает mock-object, отсутствует реальная персистентность",""
"passed","Tue May 19 20:47:58 UTC 2026","Tue May 19 20:47:58 UTC 2026","94","","TC-040: Получить photos вложенного ресурса для album","","org.izuum.jsonPlaceholder.apiTests.nestedRoutesTests.GetPhotosOfNestedResourcesForAlbumsTest","checkThatEveryElementsHasAlbumIdIsOne","TC-040: Каждый элемент имеет albumId=1",""
"passed","Tue May 19 20:48:05 UTC 2026","Tue May 19 20:48:06 UTC 2026","483","","TC-068:(БАГ) Создание post с невалидным JSON Payload","","org.izuum.jsonPlaceholder.apiTests.createResources.CreatePostWithInvalidJsonPayloadTest","checkThatClientAndServerHandlesErrorCorrectly","TC-068:(БАГ) Клиент/сервер корректно обрабатывает ошибку [1] ""{ title: 'broken' """,""
"passed","Tue May 19 20:48:05 UTC 2026","Tue May 19 20:48:05 UTC 2026","120","","TC-067: Создание post без заголовка Content-Type","","org.izuum.jsonPlaceholder.apiTests.createResources.CreatePostWithoutHeaderContentTypeTest","createPostWithoutHeaderContentType","TC-067: Статус-код не 5хх, фиксация поведения",""
"passed","Tue May 19 20:48:02 UTC 2026","Tue May 19 20:48:02 UTC 2026","91","","TC-008: Получение photo по id","","org.izuum.jsonPlaceholder.apiTests.smokeTests.GetPhotoByIdTest","getRequestCheckStatusCode","TC-008: Статус-код 200",""
"passed","Tue May 19 20:48:11 UTC 2026","Tue May 19 20:48:11 UTC 2026","189","","TC-060: Запрос несуществующего эндпоинта","","org.izuum.jsonPlaceholder.apiTests.negativeReadTests.GetNotExistsEndpointTest","checkExpectedNotFound","TC-060: Статус-код ожидается 404",""
"passed","Tue May 19 20:48:13 UTC 2026","Tue May 19 20:48:13 UTC 2026","88","","TC-112: Проверка сортировки по умолчанию","","org.izuum.jsonPlaceholder.apiTests.contractAndNonFunctionalTests.CheckSortByDefaultTest","checkThatSortByAscOrder","TC-112: Фиксация фактического порядка id в ответе",""
"passed","Tue May 19 20:48:15 UTC 2026","Tue May 19 20:48:15 UTC 2026","189","","TC-036: Некорректное значение boolean-фильтра","","org.izuum.jsonPlaceholder.apiTests.filterQueryParamTests.IncorrectValueOfBooleanFilterTest","checkThatResponseIsAnEmptyArray","TC-036: Ожидается пустой массив или игнорирование фильтра в ожидаемом поведении",""
"passed","Tue May 19 20:47:43 UTC 2026","Tue May 19 20:47:43 UTC 2026","222","","TC-116: Параметризованный запрос GET для /comments по id=1..10","","org.izuum.jsonPlaceholder.apiTests.dataDrivenTests.ParameterizedRunGetCommentTest","parameterizedGetCommentsTest","TC-116: Проверка что каждый запрос по id возвращает валидный comment [9] 9",""
"passed","Tue May 19 20:48:06 UTC 2026","Tue May 19 20:48:06 UTC 2026","131","","TC-068:(БАГ) Создание post с невалидным JSON Payload","","org.izuum.jsonPlaceholder.apiTests.createResources.CreatePostWithInvalidJsonPayloadTest","checkThatClientAndServerHandlesErrorCorrectly","TC-068:(БАГ) Клиент/сервер корректно обрабатывает ошибку [2] ""{ \""title\"": \""test\"" """,""
"passed","Tue May 19 20:47:50 UTC 2026","Tue May 19 20:47:50 UTC 2026","211","","TC-118: Параметризованный запрос GET для /photos по id=1..10","","org.izuum.jsonPlaceholder.apiTests.dataDrivenTests.ParameterizedRunGetPhotoTest","parameterizedGetPhotoTest","TC-118: Проверка что каждый запрос по id возвращает валидный photo [7] 7",""
"passed","Tue May 19 20:48:03 UTC 2026","Tue May 19 20:48:04 UTC 2026","122","","TC-089: Удаление существующего post","","org.izuum.jsonPlaceholder.apiTests.deleteDataTests.DeleteExistsPostTest","checkBodyOfRequest","TC-089: Тело либо пустое, либо {}",""
"passed","Tue May 19 20:47:57 UTC 2026","Tue May 19 20:47:57 UTC 2026","193","","Сравнение nested route с фильтрациями","","org.izuum.jsonPlaceholder.apiTests.nestedRoutesTests.CompareNestedRouteAndFilteringTest","checkThatSetsOfIdOfAlbumAreEquals","TC-048: Фильтрация для Album. Наборы id идентичны",""
"passed","Tue May 19 20:47:35 UTC 2026","Tue May 19 20:47:36 UTC 2026","504","","TC-085: Обновление post с неизвестным полем","","org.izuum.jsonPlaceholder.apiTests.partUpdateTests.UpdatePostWithUnknownFieldTest","checkThatServerStableAnswer","TC-085: Стабильный ответ сервера",""
"passed","Tue May 19 20:48:05 UTC 2026","Tue May 19 20:48:05 UTC 2026","115","","TC-063: Создаение post с полным валидным body","","org.izuum.jsonPlaceholder.apiTests.createResources.CreatePostWithValidBodyTest","checkThatStatusCodeCreated","TC-063: Статус-код 201",""
"passed","Tue May 19 20:48:00 UTC 2026","Tue May 19 20:48:00 UTC 2026","249","","TC-007: Получение коллекции photos","","org.izuum.jsonPlaceholder.apiTests.smokeTests.GetCollectionsOfPhotosTest","getRequestCheckResponseIsAnArray","TC-007: Ответ является массивом",""
"passed","Tue May 19 20:47:59 UTC 2026","Tue May 19 20:47:59 UTC 2026","83","","TC-002: Получение конкретного post по id","","org.izuum.jsonPlaceholder.apiTests.smokeTests.GetPostByIdTest","getRequestCheckThanObjectHasRequiredFields","TC-002: В объекте присутствуют обязательные поля",""
"passed","Tue May 19 20:47:40 UTC 2026","Tue May 19 20:47:40 UTC 2026","111","","TC-115: Параметризованный запрос GET для /posts по id=1..10","","org.izuum.jsonPlaceholder.apiTests.dataDrivenTests.ParameterizedRunGetPostTest","parameterizedGetPostTest","TC-115: Проверка что каждый запрос по id возвращает валидный объект и совпадающий id [4] 4",""
"passed","Tue May 19 20:48:06 UTC 2026","Tue May 19 20:48:06 UTC 2026","126","","TC-072: Создание todos с полем completed=true","","org.izuum.jsonPlaceholder.apiTests.createResources.CreateTodosWithCompletedIsTrueTest","checkThatFieldCompletedIsTrue","TC-072: Проверка что completed в ответе обрабатывается корректно",""
"passed","Tue May 19 20:47:58 UTC 2026","Tue May 19 20:47:59 UTC 2026","87","","TC-043: Получить posts пользователя","","org.izuum.jsonPlaceholder.apiTests.nestedRoutesTests.GetPostsOfUserTest","checkThatEveryElementsHasUserIdIsOne","TC-043: Каждый элемент имеет userId=1",""
"passed","Tue May 19 20:48:17 UTC 2026","Tue May 19 20:48:17 UTC 2026","95","","TC-032: Фильтрация users по id","","org.izuum.jsonPlaceholder.apiTests.filterQueryParamTests.FilteringUsersByIdTest","getIdOfElementInResponse","TC-032: id полученного элемента 1",""
"passed","Tue May 19 20:47:36 UTC 2026","Tue May 19 20:47:36 UTC 2026","273","","TC-083: Обновить несколько полей сразу","","org.izuum.jsonPlaceholder.apiTests.partUpdateTests.UpdateSomeFieldsInPostTest","checkThatAllSentFieldsAreThere","TC-083: Проверка что все отправленные поля отражены",""
"passed","Tue May 19 20:48:16 UTC 2026","Tue May 19 20:48:16 UTC 2026","87","","TC-028: Фильтрация photos по albumId","","org.izuum.jsonPlaceholder.apiTests.filterQueryParamTests.FilteringPhotosByAlbumIdTest","checkThaTAllElementsOfPhotosHasSpecificAlbumId","TC-028: Каждый photo содержит albumId = 1",""
"passed","Tue May 19 20:47:55 UTC 2026","Tue May 19 20:47:55 UTC 2026","200","","Проверка структуры объектов на каждом эндпоинте","","org.izuum.jsonPlaceholder.apiTests.structureAndTypeTests.CheckStructureOfObjectsTest","checkEqualityOfFieldsOfPosts","TC-022: Проверка однородности массива posts",""
"passed","Tue May 19 20:48:10 UTC 2026","Tue May 19 20:48:11 UTC 2026","193","","TC-061: Запрос post с некорректным путем с двойным слешем","","org.izuum.jsonPlaceholder.apiTests.negativeReadTests.GetPostWithIncorrectPathDoubleSlashTest","checkExpectedNotServerError","TC-061: Статус-код не 5хх",""
"passed","Tue May 19 20:47:57 UTC 2026","Tue May 19 20:47:57 UTC 2026","93","","TC-042: Получение todos пользователя","","org.izuum.jsonPlaceholder.apiTests.nestedRoutesTests.GetToDosOfUserTest","checkThatEveryElementsHasUserIdIsOne","TC-042: Каждый элемент имеет userId=1",""
"passed","Tue May 19 20:47:56 UTC 2026","Tue May 19 20:47:56 UTC 2026","107","","Проверка структуры объектов на каждом эндпоинте","","org.izuum.jsonPlaceholder.apiTests.structureAndTypeTests.CheckStructureOfObjectsTest","checkStructureOfGeo","TC-020: Проверка структуры geo у объекта user.address",""
"passed","Tue May 19 20:47:59 UTC 2026","Tue May 19 20:48:00 UTC 2026","87","","TC-002: Получение конкретного post по id","","org.izuum.jsonPlaceholder.apiTests.smokeTests.GetPostByIdTest","getRequestCheckIdOfObject","TC-002: id объекта равен 1",""
"passed","Tue May 19 20:48:11 UTC 2026","Tue May 19 20:48:11 UTC 2026","211","","TC-057: Запрос User с несуществующим id","","org.izuum.jsonPlaceholder.apiTests.negativeReadTests.GetUserByNotExistsIdTest","checkExpectedNotServerError","TC-057: Статус-код не 5хх",""
"passed","Tue May 19 20:47:45 UTC 2026","Tue May 19 20:47:45 UTC 2026","128","","TC-120: Параметризованный запрос GET для /users по id=1..10","","org.izuum.jsonPlaceholder.apiTests.dataDrivenTests.ParameterizedRunGetUserTest","parameterizedGetUserTest","TC-120: Проверка что каждый запрос по id возвращает валидный user [5] 5",""
"passed","Tue May 19 20:48:04 UTC 2026","Tue May 19 20:48:04 UTC 2026","182","","TC-093: Удаление album","","org.izuum.jsonPlaceholder.apiTests.deleteDataTests.DeleteAlbumTest","checkStatusCodeOfDeleteAlbum","TC-093: Статус-код 200",""
"passed","Tue May 19 20:47:59 UTC 2026","Tue May 19 20:47:59 UTC 2026","88","","TC-004: Получение comment по id","","org.izuum.jsonPlaceholder.apiTests.smokeTests.GetCommentByIdTest","getRequestCheckIdOfObject","TC-004: id объекта равен 1",""
"passed","Tue May 19 20:47:58 UTC 2026","Tue May 19 20:47:58 UTC 2026","90","","TC-043: Получить posts пользователя","","org.izuum.jsonPlaceholder.apiTests.nestedRoutesTests.GetPostsOfUserTest","getRequestCheckStatusCode","TC-043: Статус-код 200",""
